{
  "id": "no-smartphone",
  "title": "The Woman Who Wanted a Box: Mosserdale Votes on Its Hall, With and Without Phones",
  "setting": "Mosserdale is a village of about two hundred people in a west Cumbrian valley, and its hall is the last roofed thing in it that belongs to everyone. Built in 1923 as a war memorial, it has hosted the Women's Institute, wakes, whist drives, badger-group talks, and every parish vote since anyone can remember. Edith Braithwaite, 84, poured tea in it for forty years; her late husband Tom's name is on the honours board by the door. The roof now needs £48,000 the parish council does not have, and a holiday-let developer has made an offer. The council, unable to face deciding alone, has put it to the village: sell, or repair and keep.\n\nThe parish clerk, Margaret Tyson, has coupled the parish into a Civic Kernel pilot run with Cumberland Council, phone voting for the commuters and the diaspora children who moved to Carlisle and Manchester, and a paper channel in the hall itself for everyone else. Edith is everyone else. She has no smartphone and wants none; her hands are arthritic enough that a stylus is an insult; and her distrust of computers is not confusion but a position, articulately held: machines are somebody's machine, and she has never yet met the somebody. 'I want to put a paper in a box like I always have,' she tells Margaret at the post office, 'and I want to watch it counted.'\n\nHer granddaughter Katie, 26, a veterinary nurse in Cockermouth, has the phone client and adores both her grandmother and the hall. Katie will end up being Edith's window into half of this system, which is precisely the question this vote quietly tests. The old tin ballot box asked Edith to trust a seal, a public count, and neighbours' eyes. The new system promises her the same paper, the same box, the same public count, plus mathematics she cannot see and will not touch. Whether what Edith is asked to trust has grown or shrunk is not a footnote to the pilot. For her, it is the pilot.",
  "threats": [
    "T9",
    "T4",
    "T5"
  ],
  "doc_refs": [
    "§1",
    "§2",
    "§3.1",
    "§3.2",
    "§3.4",
    "§4",
    "§6",
    "§10",
    "§12",
    "T4",
    "T5",
    "T9"
  ],
  "precedents": [
    {
      "event": "Ofcom: around 1.5 million UK homes (6%) without internet access",
      "year": 2021,
      "source": "Ofcom",
      "url": "https://www.ofcom.org.uk/media-use-and-attitudes/online-habits/digital-divide-narrowed-but-around-1.5m-homes-offline",
      "shows": "Ofcom's research found 6% of UK homes offline, rising to 18% among adults 65 and over, a measured population that digital-only civic systems would disenfranchise."
    },
    {
      "event": "Estonia retains paper voting alongside i-voting, with paper supremacy",
      "year": 2005,
      "source": "Estonian State Electoral Office",
      "url": "https://www.valimised.ee/en/internet-voting/i-voting-fact-check-myth-and-reality",
      "shows": "The most digital electoral state deliberately keeps paper first-class: paper remains available and a paper ballot overrides the i-vote."
    }
  ],
  "manifest": {
    "v": "civic-kernel/manifest/v0",
    "community": {
      "id": "did:web:mosserdale-parish.example",
      "name": "Mosserdale Parish Council",
      "parent": "did:web:cumberland.example"
    },
    "services": {
      "personhood": true,
      "decisions": true,
      "rights_guard": false,
      "transparency_log": true
    },
    "personhood": {
      "method": "ceremony",
      "issuer": "parish clerk plus two VRF-selected resident observers, 2-of-3 co-signature",
      "unlinkable": true,
      "sybil_resistance": "medium",
      "eligibility_rules": "mosserdale-roll/v1"
    },
    "decisions": {
      "verifiable": true,
      "receipt_free": true,
      "cast_or_audit": true,
      "paper_channel": true,
      "trustee_quorum": "2-of-3: parish clerk, Cumberland Council electoral services, Loweswater parish clerk"
    },
    "transparency_log": {
      "log_id": "did:web:mosserdale-parish.example",
      "witnesses": [
        "did:web:loweswater-parish.example",
        "did:web:cumberland.example",
        "did:web:cumberland-news.example"
      ]
    },
    "decision_metadata": true,
    "interaction_cost": [
      {
        "process": "assisted-enrolment-in-person",
        "steps": 4,
        "fields": 2,
        "median_seconds": 780,
        "abandonment_rate": 0
      },
      {
        "process": "cast-paper-in-person",
        "steps": 3,
        "fields": 0,
        "median_seconds": 210,
        "abandonment_rate": 0
      }
    ],
    "sig": {
      "key_id": "did:web:mosserdale-parish.example#manifest-1",
      "alg": "ed25519",
      "value": "UGxhY2Vob2xkZXJTaWdOb3RSZWFsQ3J5cHRv"
    }
  },
  "walkthrough": [
    {
      "actor": "Margaret Tyson, parish clerk",
      "verb": "offstage",
      "narrative": "The February council meeting in the hall runs three hours over. The quotes for the roof are read out; the developer's offer is read out; nobody will move a motion either way. Councillor Hodgson finally says the thing everyone is thinking: 'This isn't ours to decide. Put it to the village.' Margaret agrees to run it through the Cumberland kernel pilot on one condition of her own devising, delivered while looking at the older half of the room: a paper channel, in this hall, or she resigns."
    },
    {
      "actor": "Katie Braithwaite",
      "verb": "read",
      "narrative": "In May the parish publishes its conformance manifest. Katie's client renders it in plain words and she reads it to Edith at the kitchen table, alongside the same summary Margaret has pinned, on actual paper, to the hall noticeboard: ballots verifiable and receipt-free, paper channel first-class, enrolment witnessed in person by neighbours, and, printed just as prominently, what the parish does NOT run: no rights guard, and only document-grade duplicate checking, because Margaret knows every face on the roll. Edith snorts at most of it but concedes one point: 'At least it says what it doesn't do. The county council never did that.'",
      "artifact": {
        "v": "civic-kernel/log-entry/v0",
        "type": "manifest.published",
        "community": "did:web:mosserdale-parish.example",
        "timestamp": "2026-05-04T10:00:00Z",
        "body": {
          "manifest_digest": "sha256:4b8e1d0a9c7f2e5b3a6d8c1f0e9b7a4d2c5f8e1b0a3d6c9f2e5b8a1d4c7f0e3b",
          "manifest_version": 1,
          "note": "Parish couples in for the village-hall decision; profile: personhood + decisions + log, no rights guard."
        },
        "sig": {
          "key_id": "did:web:mosserdale-parish.example#log-1",
          "alg": "ed25519",
          "value": "UGxhY2Vob2xkZXJTaWdOb3RSZWFsQ3J5cHRv"
        }
      }
    },
    {
      "actor": "Edith Braithwaite",
      "verb": "prove",
      "narrative": "Enrolment Saturday, in the hall. Edith brings her bus pass and her rage. Margaret officiates; two observers picked by verifiable lottery, Alan Postlethwaite from the fell farm and a student home from Lancaster, co-sign every credential, so no single hand mints a voter. Phone owners enrol onto their own devices. Edith's credential is generated on a smartcard at the assisted station: the key is made in front of her, the card is handed to her, and it goes home to the kitchen drawer where Tom's medals live. The log records fourteen credentials issued at this time and place, a count, an officiant, never a name. What Edith cannot see, and says so, is whether the little grey machine kept a copy of what it just gave her. Nobody in the room can answer her with anything better than the co-signature and Alan's word.",
      "artifact": {
        "v": "civic-kernel/log-entry/v0",
        "type": "x-enrolment.ceremony",
        "community": "did:web:mosserdale-parish.example",
        "timestamp": "2026-05-16T11:30:00Z",
        "body": {
          "ceremony_id": "2026-05-16-village-hall",
          "location": "Mosserdale Village Hall, main room",
          "officiant": "parish-clerk",
          "observers": 2,
          "credentials_issued": 14,
          "assisted_enrolments": 6,
          "credential_medium": {
            "phone-enclave": 8,
            "smartcard": 6
          }
        },
        "sig": {
          "key_id": "did:web:mosserdale-parish.example#log-1",
          "alg": "ed25519",
          "value": "UGxhY2Vob2xkZXJTaWdOb3RSZWFsQ3J5cHRv"
        }
      }
    },
    {
      "actor": "Katie Braithwaite",
      "verb": "read",
      "narrative": "The decision opens on the first of June with a three-week deliberation window. Katie's phone shows the entry; the noticeboard shows the identical text, the exact question, the closing times, and a QR code that resolves to the same hash, because Margaret prints from the log, not alongside it. The one-page plain-language summary required by the decision-metadata line in the manifest goes through every letterbox in the valley: what the repair costs, what the developer pays, arguments for each, and who wrote which argument.",
      "artifact": {
        "v": "civic-kernel/log-entry/v0",
        "type": "decision.opened",
        "community": "did:web:mosserdale-parish.example",
        "timestamp": "2026-06-01T18:00:00Z",
        "body": {
          "decision_id": "2026-hall-closure",
          "question_hash": "sha256:9f2b7c1a0d4e8f3b6a5c2e1d7f0a9b8c3d6e5f4a1b2c3d4e5f6a7b8c9d0e1f2a",
          "eligibility_rules": "mosserdale-roll/v1",
          "window": {
            "deliberation_ends": "2026-06-19T18:00:00Z",
            "cast_ends": "2026-06-20T16:00:00Z"
          },
          "channels": [
            "phone",
            "paper-in-person"
          ],
          "metadata_digest": "sha256:2a5d8c1f0e3b6a9d4c7f2e5b8a1d0c3f6e9b2a5d8c1f4e7b0a3d6c9f2e5b8a1d"
        },
        "sig": {
          "key_id": "did:web:mosserdale-parish.example#log-1",
          "alg": "ed25519",